wavenum,ideo5,edits_clean_text,qpos,trump_stance_auto,lexicoder_sentiment,fold,vader_sentiment,SVM_sentiment,BERT_sentiment,SVM_stance,BERT_stance,vader_scores
12,Liberal,donald trump is still president,0,0,,2,,0,0,0,0,0
12,Liberal,donald trump,0,0,,3,,0,0,0,0,0
12,Moderate,that the ever increasing lawlessness of the donald trump administration will become the new normal for future administrations to come,0,0,,4,,0,0,0,0,0
12,Liberal,take forever to undo all the damage donald trump and mitch mcconnell have inflicted upon us,0,0,0,2,0,0,0,0,0,-0.4939
12,Moderate,another 4 years of donald trump,0,0,,4,,0,1,0,1,0
12,Liberal,it worries me that donald trump could be reelected,0,0,0,5,0,0,0,0,0,-0.4215
12,Very liberal,donald trump collusion with ukraine donald trump imprisonment of children donald trump ruining the ecology the earth,0,0,0,3,0,0,0,0,0,-0.25
12,Moderate,new president,0,0,,1,,1,1,0,0,0
12,Very liberal,people will continue to support donald trump,0,0,1,3,1,0,1,0,0,0.4019
12,Very liberal,that the president will start a war,0,0,0,2,0,0,0,0,0,-0.5994
12,Conservative,the stupid democrats who want to fight donald trump at every turn,0,1,0,5,0,0,0,1,1,-0.6908
12,Conservative,donald trump,0,0,,5,,0,0,0,0,0
12,Liberal,the president and his inability to lead without causing more drama,0,0,0,5,0,0,0,0,0,-0.4019
12,Very conservative,continued stonewalling by democrats and a complete unwillingness to accept anything proposed by donald trump,0,1,,4,1,0,0,0,1,0.3818
12,Very conservative,the possibility that one of the left loons might be elected president,0,1,,1,,1,0,1,1,0
12,Very liberal,donald trump is president and mitch mcconnell is blocking anything from going through the senate,0,0,0,1,0,0,0,0,1,-0.3818
12,Moderate,reelecting mr donald trump,0,0,,5,,0,1,0,1,0
12,Moderate,the president being reelected and packing supreme court with ultra conservatives,0,0,,1,1,0,0,1,1,0.5574
12,Very liberal,that donald trump would win a second term,0,0,1,5,1,0,0,1,0,0.5859
12,Very liberal,that donald trump will be reelected and that democrats wont take the majority in the senate or hold the house,0,0,,3,,0,0,0,0,0
12,Liberal,i worry about a second term for donald trump i worry about war,0,0,0,1,0,0,0,0,0,-0.8658
12,Moderate,donald trump is reelected,0,0,,5,,0,0,0,0,0
12,Liberal,president will continue illegal behavior,0,0,0,1,0,0,0,1,0,-0.5574
12,Liberal,joe biden and donald trump are way too popular there are also way too many not using policies rather than identity to guide their support,0,0,0,5,1,0,0,0,0,0.6705
12,Moderate,another four years of donald trump,0,0,,4,,0,1,1,0,0
12,Very liberal,donald trump,0,0,,4,,0,0,0,0,0
12,Very liberal,the possibility that donald trump base continues to grow and he would be elected again makes me sick !,0,0,0,2,0,0,0,0,0,-0.5562
12,Conservative,a socialist in the white house,0,1,,4,,0,0,0,1,0
12,Very conservative,fake news and stupid attacks on president donald trump,0,1,0,1,0,0,0,1,1,-0.8555
12,Moderate,economic recession donald trump refusing to leave office,0,0,0,4,0,1,0,1,0,-0.6908
12,Conservative,it worries me that our current president will get us into a conflict with long lasting impact,0,0,0,5,0,0,0,0,0,-0.6249
12,Liberal,donald trump may be reelected,0,0,,3,,0,0,0,0,0
12,Conservative,the sowing of hatred for president donald trump and his supporters half the country including me through indoctrination of ill informed young adults who are being urged to spout hateful rhetoric and commit violent acts against these peaceful innocent citizens,0,1,0,3,0,0,0,0,1,-0.6597
12,Very conservative,not electing donald trump again !,0,0,,1,,1,1,0,0,0
12,Moderate,reelecting donald trump,0,0,,2,,0,0,0,0,0
12,Liberal,wondering what donald trump is going to destroy next,0,0,0,2,0,0,0,0,0,-0.5423
12,Conservative,i feel the president will continue to work for the country but so many will try to stand in his way,0,1,,5,,1,1,1,1,0
12,Very liberal,the failure to get rid of donald trump,0,0,0,2,0,1,0,0,0,-0.5106
12,Liberal,im not just worried im scared that donald trump wont be impeached or gets impeached but not convicted and continues the corruption and dangerous activities im scared that it might be too late for any climate policies that may get passed after 2020 will have any real effect im scared that even if the democrats win the senate presidency and keep the house they wont have the courage to make big changes that will have real positive effects on our lives im scared of what donald trump will do if impeachment proceeds hes especially dangerous when hes scared im scared that it will take decades to recover from this im scared that every complicit person wont face consequences or be normalized into society im scared every day my kids are in school and im afraid i will never be able to go out in public again without mentally planning my escape if there were to be a mass shooter im afraid for what kind of lives those people especially the kids will live once they get out of those cages im afraid more people will die because they cant afford their healthcare im afraid of more climate disasters and the lives and cost that entails im afraid that we will never change the hearts of those who hate,0,0,0,5,0,0,0,0,0,-0.9946
12,Very conservative,that democrats will stop at nothing to harm our president,0,1,0,4,1,0,0,1,1,0.1655
12,Liberal,i worry most about climate change the damage donald trump is doing to the environment may not be able to be fixed,0,0,0,5,0,0,0,0,0,-0.7269
12,Very liberal,donald trump,0,0,,5,,0,0,0,0,0
12,Liberal,deep fakes in the news disinformation from foreign countries donald trump and republicans,0,0,0,5,0,0,0,0,0,-0.4215
12,Liberal,donald trump,0,0,,3,,0,0,0,0,0
12,Liberal,donald trump is reelected,0,0,,4,,0,1,0,1,0
12,Very conservative,all the democratic candidates for president,0,1,,2,,1,1,1,0,0
12,Moderate,i worry that donald trump will continue to destroy our country and do illegal acts without suffering any consequences such as impeachment,0,0,0,4,0,0,0,0,0,-0.8149
12,Liberal,what worries me is i no longer trust the voting system and the people in charge of the u s government donald trump bill barr moscow mitch mcconnell mike pence brett kavanaugh and list goes on are obviously corrupt,0,0,0,5,0,0,0,0,0,-0.7719
12,Moderate,the fact that discrimination hate speech is now common place and has seen to become accepted there is a rise in antisemitism and other forms of hate for immigrants black and brown and the erosion of womens rights and climate control guidelines with this president,0,0,0,2,0,0,0,0,0,-0.743
12,Moderate,if a leftist gets elected president and tries to spend trillions of dollars that we dont have which will cause tax increases,0,0,,3,,1,0,1,1,0
12,Very liberal,reelecting donald trump,0,0,,4,,0,1,0,0,0
12,Liberal,climate change president donald trump,0,0,,2,,0,0,0,0,0
12,Conservative,democrat house wasting 4 years on bullsh   when they could have helped the president make this economy and our safety better,0,1,1,3,1,1,0,1,1,0.4588
12,Liberal,if we get the same president,0,0,,5,,0,0,0,0,0
12,Conservative,the democrats will try to steal the election away from donald trump or start another coup attempt,0,1,0,2,0,0,0,1,1,-0.4939
12,Very liberal,what if donald trump gets reelected,0,0,,1,,0,0,0,1,0
12,Moderate,more donald trump stupidity and the senate protecting him,0,0,,3,0,0,0,0,0,-0.4877
12,Moderate,the possibility that people are stupid enough to elect another democrat as president ! donald trump is just getting all the stuff barack obama has screwed up over the last 8 years when he was trying to be our president !,0,1,0,5,0,0,0,1,1,-0.8011
12,Conservative,the presidential election either donald trump will stay in or someone else will get in that wants socialism both are bad,0,1,0,1,0,1,0,0,0,-0.5423
12,Moderate,the president,0,0,,5,,0,0,1,0,0
12,Very liberal,donald trump and his chicken hawk staff the corporate democrats and the corrupt dnc mainstream media,0,0,0,3,,0,0,1,0,0
12,Liberal,im still concerned that donald trump will cause more division and hatred in this country also im concerned that mitch mcconnell wont allow reasonable bills to be voted on in the senate,0,0,0,1,0,0,0,0,0,-0.7294
12,Conservative,president donald trump,0,0,,2,,1,1,1,1,0
12,Not sure,donald trump being reelected,0,0,,2,,0,0,0,0,0
12,Moderate,that donald trump will get by with all the crap he is doing and get reelected,0,0,0,3,0,1,1,1,1,-0.3818
12,Very liberal,that donald trump will declare himself permanent president and wont leave office if voted out,0,0,,5,1,0,1,0,0,0.0382
12,Very liberal,donald trump,0,0,,5,,0,0,0,0,0
12,Moderate,reelection of donald trump,0,0,,4,,1,1,1,1,0
12,Liberal,that donald trump will continue his lies etc,0,0,,2,0,0,0,0,0,-0.4215
12,Moderate,democrats and their lies and obsession of impeachment of a duly elected president,0,1,,4,0,0,0,1,1,-0.6369
12,Conservative,democrats spending all their time trying to impeach the president,0,1,,1,,0,0,1,1,0
12,Liberal,its the division created by russia and the republican bots the racism that has been given a green light by this president is a blood stain on our humanity it is the about me first message and to hell with everyone else we are a country that needs to understand that helping one is helping all i worry about the refugees and the disappointing knowledge that a man like donald trump can get ordinary people to do horrific things,0,0,0,5,0,0,0,1,0,-0.9231
12,Liberal,keeping donald trump in office,0,0,1,5,,1,0,0,0,0
12,Liberal,that donald trump is going to being in charge again i feel like he has a very good chance of winning again or heaven forbid something even worse someone even worse winning i dont know who this person is it could always be worse,0,0,,3,1,0,1,0,0,0.7559
12,Moderate,donald trump not getting impeached,0,0,,5,,1,0,0,0,0
12,Very conservative,donald trump not winning,0,1,1,1,0,0,0,1,1,-0.4168
12,Conservative,donald trump getting reelected,0,1,,2,,0,0,0,0,0
12,Not sure,donald trump reelection,0,0,,3,,1,1,1,1,0
12,Very liberal,if we keep the business man that call himself president this country is about to see the worst of a human bean,0,0,0,5,0,1,1,1,0,-0.6249
12,Very liberal,that donald trump isnt held accountable for what he has done,0,0,1,4,,1,0,0,0,0
12,Very conservative,that the democrats china will do everything they can to prevent donald trump from being reelected even if that requires destroying the u s economy,0,1,0,3,0,0,0,1,1,-0.5423
12,Moderate,if donald trump gets reelected,0,0,,1,,0,1,0,1,0
12,Very liberal,donald trump might be reelected,0,0,,3,,0,0,0,0,0
12,Conservative,everything to do with donald trump,0,0,,4,,0,0,0,0,0
12,Liberal,republicans protecting a lawless president,0,0,,3,,0,0,0,0,0
12,Conservative,the democrats and their nastiness towards our president,0,1,0,5,0,0,0,1,1,-0.2732
12,Liberal,donald trump getting reelected,0,0,,2,,0,0,0,0,0
12,Very liberal,the fact that donald donald trump will win the next election thanks vhf to the electoral college,0,0,1,3,1,0,1,0,0,0.7717
12,Very liberal,the donald trump administration,0,0,,4,,0,0,0,0,0
12,Liberal,donald trump and his behavior and poor choices as president,0,0,0,4,0,0,0,0,0,-0.4767
12,Moderate,that donald trump will continue to damage and divide our country against itself,0,0,0,2,0,0,0,0,0,-0.4939
12,Conservative,donald trump bashing,0,1,,1,,0,0,1,1,0
12,Very liberal,the fact that donald trump is president,0,0,,5,,0,0,0,0,0
12,Moderate,donald trump get reelected,0,0,,1,,0,0,1,0,0
12,Very liberal,a centrist democrat going against donald trump in the general and losing just like in 2016,0,0,0,3,0,0,1,0,0,-0.0258
12,Liberal,the possibility of donald trump for four more years and more so the possibility of donald trump getting us into a war and he has no idea of what hes doing,0,0,0,2,0,0,0,0,0,-0.7269
12,Moderate,prospect that donald trump may be reelected and republicans still control senate,0,0,,4,1,0,1,0,0,0.296
12,Moderate,i feel that the president needs to held accountable for things he does and says that just seems like it wont happen,0,0,1,1,1,0,0,0,0,0.3612
12,Very liberal,donald trump continuing to be in power,0,0,,3,,0,0,0,0,0
12,Very liberal,if donald trump doesnt get impeached,0,0,,1,,0,0,0,0,0
12,Moderate,donald trump winning reelection,0,0,1,3,1,1,1,1,0,0.5267
12,Liberal,president donald trump reelected,0,0,,5,,0,1,1,1,0
12,Very liberal,what more damage donald trump can do before hes gone,0,0,0,2,0,1,0,0,0,-0.5413
12,Liberal,that donald trump will get america involved in a war that we should have never been involved in,0,0,0,5,0,0,0,0,0,-0.5994
12,Conservative,the current president,0,1,,3,,0,0,0,0,0
12,Conservative,democrats taking over the white house,0,1,,1,,0,0,1,1,0
12,Liberal,donald trump in office,0,0,,3,,0,0,0,0,0
12,Very liberal,donald trump might get a second term,0,0,,3,,0,0,0,1,0
12,Very liberal,donald trump,0,0,,5,,0,0,0,0,0
12,Moderate,elizabeth warren and bernie sanders and their ilk as well as donald trump the government is a big mess ! ! ! !,0,0,,1,0,0,0,0,0,-0.3753
12,Liberal,the fact that donald trump and the republicans cheating,0,0,0,4,0,0,0,0,0,-0.5574
12,Liberal,donald trump being reelected,0,0,,1,,0,0,0,0,0
12,Very liberal,donald trump incompetence and arrogance,0,0,0,2,0,0,0,0,0,-0.7717
12,Very liberal,that donald trump could get a second term,0,1,,4,,0,0,0,0,0
12,Very liberal,that donald trump prevails by cheating,0,0,0,3,0,1,1,0,1,-0.5574
12,Not sure,the president may start another war,0,1,0,5,0,0,0,0,0,-0.5994
12,Conservative,that are current president will be reelected,0,0,,4,,0,0,0,0,0
12,Moderate,donald trump will get into office,0,0,,5,,0,0,0,0,0
12,Very liberal,anything related to donald trump psychotic a hole could nuke iran at any minute,0,0,0,5,,0,0,0,0,0
12,Very liberal,the 2020 election and possibility that donald trump will be reelected,0,0,,5,,1,1,0,0,0
12,Liberal,more lies from donald trump,0,0,,2,0,0,0,0,0,-0.4754
12,Liberal,donald trump doing everything he can to start a war with iran in order to try to distract from everything else he has done also russian interference with elections,0,0,0,4,0,0,0,0,0,-0.7269
12,Very liberal,donald trump,0,0,,1,,0,0,0,0,0
12,Very liberal,that donald trump will be reelected,0,0,,5,,0,0,0,0,0
12,Moderate,donald trump,0,0,,5,,0,0,0,0,0
12,Liberal,donald trump getting reelected,0,1,,3,,0,0,0,1,0
12,Very liberal,that the russians will again work to mess with the american people and that donald trump will win more followers !,0,0,,5,1,0,0,0,0,0.3802
12,Very liberal,if donald trump is reelected i worry about the state of the nation,0,0,0,3,0,0,0,0,0,-0.4404
12,Liberal,that mr donald trump will lead us to another armed conflict,0,0,0,2,0,0,0,0,0,-0.3182
12,Very liberal,donald trump will probably be reelected people underestimate his chances,0,0,,2,0,0,0,0,0,-0.1027
12,Very liberal,donald trump will steal the presidency again by enlisting the help of foreign power,0,0,,5,0,0,0,0,0,-0.128
12,Liberal,that donald trump will be reelected,0,0,,4,,0,0,0,0,0
12,Very liberal,donald trump his republican fellow travelers and the fascist thugs they enable,0,0,0,1,0,0,0,0,0,-0.5574
12,Moderate,that donald trump will get reelected,0,0,,1,,0,0,1,0,0
12,Liberal,donald trump wins in 2020,0,0,1,4,1,1,1,1,1,0.5719
12,Very liberal,this is tough there are so many things so choosing one is difficult but i would say there is a potential for the u s under donald trump to get into another war,0,0,0,4,0,0,1,0,0,-0.81
12,Liberal,that donald trump wins again,0,0,1,5,1,0,0,0,0,0.5719
12,Very liberal,the current white house occupant will do something to further undermine our democracy with the support of his base,0,0,,3,1,0,0,0,0,0.128
12,Liberal,the breakdown of our system of checks and balances and the vitriolic tribalism that donald trump is orchestrating,0,0,,1,0,0,0,0,0,-0.4767
12,Liberal,donald trump will still be here,0,0,,2,,1,1,0,1,0
12,Moderate,donald trump being reelected,0,0,,5,,0,0,0,0,0
12,Very liberal,donald trump winning election,0,0,1,2,1,1,1,1,0,0.5267
12,Very conservative,a democrat in the white house,0,1,,1,,0,0,0,1,0
12,Liberal,donald trump policies will result in a major recession either because of his tariff policy or he will stumble us into a war,0,0,0,4,0,0,0,0,0,-0.7902
12,Liberal,im afraid the president will bankrupt the country start a war or both,0,0,0,1,0,0,0,0,0,-0.8176
12,Conservative,that donald trump wont be reelected,0,1,,1,,0,1,0,0,0
12,Moderate,donald trump may get us into another war,0,0,0,1,0,0,0,0,0,-0.5994
12,Liberal,that donald trump will win a second term instead of being impeached,0,0,1,2,1,1,0,0,0,0.5859
12,Liberal,that donald trump will be reelected,0,0,,3,,0,0,0,0,0
12,Very liberal,the fact that nothing is being done to check the power of a fundamentally corrupt president,0,0,0,4,,1,0,0,0,0
12,Moderate,donald trump ism and the failure of the senate to do its job as an independent government branch,0,0,0,2,0,0,0,0,0,-0.5106
12,Conservative,we elect the wrong president to govern our country,0,1,0,3,0,0,0,0,0,-0.4767
12,Very liberal,that congress wont act on the recent reporting about donald trump quid pro quo phone call with the president of ukraine and that they wont impeach the motherf   er already,0,0,0,4,,0,0,0,0,0
12,Moderate,donald trump will carry on as he has been,0,0,,3,,0,1,0,1,0
12,Very liberal,that donald trump remains in office,0,0,,3,,0,0,0,0,0
12,Liberal,donald trump and his lies how he supports hostile foreign leaders how he thinks he is above the law,0,0,,2,0,0,0,0,0,-0.4404
12,Very liberal,that donald trump will do anything to get reelected even if it means risking americas security,0,0,0,5,1,0,0,1,0,0.0258
12,Very conservative,the damage that donald trump has to our government domestically internationally and globally,0,0,0,3,0,0,0,0,0,-0.4939
12,Very liberal,the president his administration democrats being too wishy washy to do anything everything about the climate,0,0,0,5,,0,0,0,0,0
12,Very liberal,donald trump mismanagement of economy and national security,0,0,,4,1,1,0,1,0,0.34
12,Very liberal,republicans allowed donald trump to destroy environmental protections which may make it too late to reverse climate change,0,0,,3,0,0,0,0,0,-0.5423
12,Very liberal,donald trump,0,0,,4,,0,0,0,0,0
12,Liberal,a new presidential election and the chance of donald trump being reelected,0,0,,1,1,0,0,0,0,0.25
12,Very liberal,losing freedoms including religious and gun freedoms both of which are given to us by the constitution having more taxes that people cant afford to pay having donald trump say the wrong thing to the wrong person and getting us into war school or public place shootings,0,0,0,5,0,0,0,0,0,-0.8861
12,Conservative,the democrats taking the white house,0,1,,5,,0,0,1,1,0
12,Moderate,4 more years of donald trump,0,0,,4,,0,1,1,1,0
12,Liberal,anything the current president does he is unstable and unfit for office im really afraid hes going to get us in a war with iran,0,0,0,3,0,0,0,0,0,-0.7506
12,Very liberal,that bernie sanders wont become president,0,0,,2,,0,0,0,0,0
12,Moderate,maybe 4 more years of a hole donald trump,0,0,,5,,1,0,0,0,0
12,Liberal,i feel donald trump is a like a dictator he does what he feels like doing he thinks hes above the law,0,0,1,2,1,0,0,0,0,0.6124
12,Very liberal,more donald trump,0,0,,4,,0,0,0,0,0
12,Conservative,if a democrat gets elected president,0,1,,3,,1,1,1,1,0
12,Conservative,a democrat winning the white house,0,1,1,4,1,0,0,1,1,0.5267
12,Liberal,having a centrist democrat or donald trump in the white house for the next 4 years,0,0,,3,,0,0,0,1,0
12,Very conservative,a democrat president,0,1,,1,,0,0,1,0,0
12,Liberal,donald trump scares me he is a loose cannon,0,0,0,3,0,0,0,0,0,-0.5719
12,Liberal,re electing donald trump pushing the country ever closer to collapse ruth bader ginsburg dying and letting donald trump pick another supreme court justice,0,0,0,2,1,1,1,1,1,0.5859
12,Liberal,if donald trump somehow wins reelection,0,0,1,3,1,0,0,0,0,0.5719
12,Very liberal,donald trump not being impeached,0,0,,3,,1,0,0,1,0
12,Moderate,donald trump wins,0,0,1,4,1,1,1,1,1,0.5719
12,Liberal,the war donald trump is trying to involve us in now,0,0,0,2,0,0,0,0,0,-0.5994
12,Very conservative,democrats trying to push socialism and impeachment of our president which will further divide our nation,0,1,0,1,,1,0,1,1,0
12,Very liberal,going to war with iran donald trump increasing irrationality,0,0,0,5,0,0,0,0,0,-0.765
12,Very liberal,donald trump is still in the white house,0,0,,1,,0,0,0,0,0
12,Moderate,that donald trump might be reelected,0,0,,5,,0,0,0,0,0
12,Very liberal,donald trump,0,0,,3,,0,0,0,0,0
12,Moderate,donald trump,0,0,,2,,0,0,0,0,0
12,Very liberal,donald trump will win we will continue to destroy the planet,0,0,,5,1,0,0,0,0,0.0772
12,Very conservative,that president will cause a war,0,0,0,2,0,0,0,0,0,-0.5994
12,Moderate,the way donald trump is misleading the country and all his wrong doing,0,0,0,4,0,0,0,0,0,-0.7003
12,Moderate,donald trump being reelected,0,0,,1,,0,0,0,0,0
12,Moderate,donald trump taking us to war,0,0,0,5,0,0,0,0,0,-0.5994
12,Liberal,president donald trump maybe being the president again,0,0,,4,,1,1,0,0,0
12,Liberal,donald trump,0,0,,1,,0,0,0,0,0
12,Very conservative,that someone other than donald trump wins,0,1,1,5,1,1,1,0,0,0.5719
12,Very conservative,a democrat getting elected as president,0,1,,5,,0,0,1,1,0
12,Very conservative,a dumb ass democrat is elected president,0,1,0,2,0,0,0,1,0,-0.7783
12,Conservative,that hillary clinton the drunk will get back in the president race,0,1,0,1,0,1,1,1,0,-0.34
12,Conservative,worried if donald trump isnt reelected we dont want socialism,0,1,0,1,0,0,0,1,0,-0.3447
12,Not sure,congress not doing their job for americans they need to leave the president alone and do whats best for america get muslims out of office before they take over america they seem to have forgotten 9 11 01,0,1,,3,1,1,0,1,1,0.2732
12,Moderate,donald trump,0,0,,3,,0,0,0,0,0
12,Very liberal,impeachment of donald trump and ascension of mike pence,0,0,,2,,1,1,0,0,0
12,Liberal,donald trump,0,0,,3,,0,0,0,0,0
12,Very liberal,that we may reelect donald trump,0,0,,5,,1,1,1,1,0
12,Very liberal,if the president isnt a real progressive but owned by billionaires they are policies will be more inaction to protect the status quo and the world will continue down this terrible path,0,0,1,2,0,0,0,0,0,-0.6226
12,Not sure,president donald trump decisions,0,0,,4,,0,1,1,1,0
3,Moderate,donald trump,1,1,,1,,0,0,0,0,0
3,Very conservative,donald trump,1,1,,2,,0,0,0,0,0
3,Very conservative,donald trump election,1,1,,4,,1,1,0,0,0
3,Conservative,donald trump looks like hes picking a conservative cabinet,1,1,1,3,1,0,1,0,0,0.3612
3,Moderate,because donald trump is a businessman hopeful he can help with all this debt we have,1,1,1,3,1,1,1,1,1,0.481
3,Conservative,donald trump,1,1,,3,,0,0,0,0,0
3,Moderate,president donald trump,1,1,,4,,1,1,1,1,0
3,Moderate,donald trump,1,0,,4,,0,0,0,0,0
3,Conservative,that donald trump represents a fresh start without obligation to special interest and lobbyists,1,1,1,5,1,1,1,0,1,0.4664
3,Very conservative,donald trump,1,1,,3,,0,0,0,0,0
3,Very conservative,donald trump will deport illegals build a wall cut taxes repeal obamacare and so much more ! the country will once again see the darkness liberalism drug us down into !,1,1,0,2,0,1,1,1,1,-0.5696
3,Conservative,im looking forward to donald trump reversing the liberal policies of the previous administration im looking forward to the economy growing and donald trump creating new job opportunities for everybody reducing the amount of people on welfare and secure our borders and optimistic for the future of america,1,1,1,4,1,1,1,1,1,0.8481
3,Liberal,the donald trump will make such a mess of things the democrats will ultimately regain power,1,0,0,5,0,0,0,0,0,-0.3612
3,Very conservative,that donald trump will change things,1,1,,3,,1,1,0,0,0
3,Moderate,maybe donald trump will be able to correct at least some of our problems hopefully more jobs will be created the iran agreement repealed something done about immigration etc,1,1,1,3,1,1,1,1,1,0.6369
3,Very conservative,only if president donald trump is able to drain the swamp,1,1,,1,,1,1,1,1,0
3,Very conservative,i hope and i trust that president elect donald trump will deliver on his campaign promises and start a cleansing process,1,1,1,2,1,1,1,1,1,0.8316
3,Moderate,one thing about donald trump is he isnt a politician and doesnt know what cant be done maybe just maybe he will get things done shake up washington ignore the lobbyists and listen to the people he isnt in the back pocket of anyone,1,1,0,2,0,1,1,0,1,-0.4939
3,Conservative,electing donald trump,1,1,,2,,1,1,0,1,0
3,Conservative,donald trump removed lobbyists donald trump chose not to take a salary i believe that he is earnest in wanting to clean up corruption in dc,1,1,1,3,1,1,1,1,1,0.7184
3,Moderate,donald trump a businessman give him a chance he might some prize us,1,0,1,1,1,0,0,0,1,0.6486
3,Conservative,donald trump not taking any pay talking about getting things done for all not just a select few,1,1,,5,1,0,0,1,1,0.0762
3,Conservative,donald trump he isnt a career politician,1,1,,1,,1,1,1,0,0
3,Conservative,that donald trump is president,1,1,,4,,1,1,1,1,0
3,Very conservative,that donald trump will be our president,1,1,,2,,1,1,0,1,0
3,Conservative,donald trump,1,1,,5,,0,0,0,0,0
3,Conservative,president elect donald trump will work for american people not the special interests group he will put our countrys interests and american first he will rebuild law and order which has been missing in our country for too long ! also president elect donald trump will improve our economy renegotiate trade deals which have been so unfair to the u s a other countries have been taking advantages of us and taking it for granted president donald trump will stop this which is a very good news to americans !,1,1,1,3,1,1,1,1,1,0.1993
3,Conservative,donald trump,1,1,,2,,0,0,0,0,0
