wavenum,ideo5,edits_clean_text,qpos,trump_stance_auto,lexicoder_sentiment,fold,vader_sentiment,SVM_sentiment,BERT_sentiment,SVM_stance,BERT_stance,vader_scores
3,Liberal,donald trump,0,0,,4,,0,0,0,0,0
3,Very liberal,violence the rise of the alt right steve bannon donald trump seemingly complete lack of knowledge of what the president needs to do also his appointments to his cabinet are frightening koch and tea party lowlifes,0,0,0,5,0,0,0,0,0,-0.8779
3,Liberal,donald trump,0,0,,1,,0,0,0,0,0
3,Conservative,that there will be some politicians that will sabotage any ideas made and the ones being paid by the insurance companys many will be looking for everything donald trump does wrong so there will be no forward progress,0,1,,2,0,1,0,1,0,-0.8759
3,Very liberal,donald trump,0,0,,1,,0,0,0,0,0
3,Very liberal,i worry that donald trump will actually do some of the things he talked about and also that he will forget all about keeping social security as it is,0,0,0,5,0,1,0,0,0,-0.34
3,Conservative,donald trump lack of experience,0,1,0,4,0,0,0,0,0,-0.3182
3,Moderate,it is the same political bs donald trump will divide the country more than ever is my prediction ! the middle class will shrink the rich will get richer ! within 8 years we will have a have a depression maybe worse then we have ever had nothing was done to stop the 2008 recession and wall street is at it again,0,0,0,2,0,0,0,0,0,-0.658
3,Moderate,donald trump doesnt have enough political background,0,0,,4,,0,0,0,0,0
3,Liberal,donald trump,0,0,,5,,0,0,0,0,0
3,Liberal,donald trump and his chosen people,0,0,,3,,0,0,0,0,0
3,Very conservative,that the democrats and the demented press will try to interfere as mr donald trump endeavors to reverse all the bad things that barack obama did to our country,0,1,0,4,0,0,0,1,1,-0.5423
3,Moderate,donald trump,0,0,,5,,0,0,0,0,0
3,Very liberal,im afraid donald trump might forget the low people on the totem pole helping the rich get richer worries me,0,0,,3,1,0,0,0,0,0.5267
3,Moderate,donald trump,0,0,,4,,0,0,0,0,0
3,Liberal,im afraid that donald trump will do exactly what he says he will do try to deport millions of mexican immigrants cease allowing muslims into our country bed down with the russians destroy clean air etc etc and otherwise tear this country apart,0,0,0,5,0,0,0,1,1,-0.2023
3,Very liberal,donald trump,0,0,,3,,0,0,0,0,0
3,Conservative,donald trump may not keep his promises,0,1,,3,0,1,0,1,1,-0.2924
3,Very liberal,the destabilizing influence of donald trump lack of foreign policy economic markets crashing due to donald trump trade and tax policies repeal of the affordable care act destruction of the environment due to elimination or gutting of the epa and executive environmental mandates,0,0,0,2,0,0,0,0,0,-0.4215
3,Conservative,the way donald trump is,0,0,,2,,0,0,0,0,0
3,Moderate,donald trump in general,0,0,,3,,0,0,0,0,0
3,Moderate,1 terrorism 2 continued civil unrest related to the election of donald trump our country not coming together this worries me,0,1,0,5,0,0,0,0,0,-0.8338
3,Moderate,donald trump surrounding himself and listening to racist homophobic anti lgbtq advisors and giving tax breaks to the supper wealthy white ignoring the needs and aspirations of the working and middle class,0,0,0,4,0,0,0,0,0,-0.6249
3,Moderate,donald trump,0,0,,1,,0,0,0,0,0
3,Moderate,the damage that donald trump will do he knows nothing about politics,0,0,0,3,0,0,0,0,0,-0.4939
3,Liberal,uncertainty meaning donald trump might not get the support he needs and cooperation to get things on the right track or people who arent qualified,0,0,1,3,0,0,0,0,0,-0.5659
3,Very liberal,donald trump,0,0,,2,,0,0,0,0,0
3,Very liberal,donald trump,0,0,,3,,0,0,0,0,0
3,Conservative,that a president donald trump wont follow through with what he has promised in other words i fear that he will become the typical politician,0,1,0,2,0,1,0,1,1,-0.1779
3,Liberal,donald trump,0,0,,1,,0,0,0,0,0
3,Liberal,donald trump,0,0,,3,,0,0,0,0,0
3,Moderate,president elect donald trump,0,0,,2,,1,1,0,1,0
3,Very conservative,politics as usual will prevent president donald trump from implementing the changes that americans overwhelmingly voted for,0,1,0,1,0,1,0,1,1,-0.1027
3,Conservative,donald trump,0,0,,3,,0,0,0,0,0
3,Conservative,bias against donald trump,0,1,0,2,0,0,0,1,0,-0.1027
3,Moderate,that mr donald trump will make our earth uninhabitable for the next generation from using coal and gas instead of the natural things we have like wind and water ! also that he is going to allow them to continue the north dakota sioux pipeline and poison the maxine waters ! !,0,0,,3,1,0,0,0,0,0.5067
3,Liberal,the donald trump administration seems to be filled with people who are bigoted incompetent or otherwise unsuitable for work in a presidential administration,0,0,0,4,0,0,0,0,0,-0.4767
3,Moderate,that donald trump will lose his temper and start another war donald trump wont do anything that he said he will,0,0,0,3,0,0,0,0,0,-0.8555
3,Liberal,donald trump presidency with republican control of the house and senate,0,0,,1,,1,1,0,1,0
3,Not sure,everything with donald trump being president hes very unpredictable,0,0,0,4,,0,0,0,0,0
3,Moderate,donald trump,0,0,,4,,0,0,0,0,0
3,Moderate,donald trump been president,0,0,,2,,0,1,0,0,0
3,Moderate,donald trump,0,0,,4,,0,0,0,0,0
3,Very liberal,donald trump being our president with an unchecked congress,0,0,,3,,0,0,0,0,0
3,Liberal,donald trump as our president and that he is going to get us involved in a war and give tax incentives to the rich and forget about the working class,0,0,,5,1,0,0,0,0,0.0258
3,Conservative,the damage barack obama can do before donald trump takes office,0,1,0,2,0,0,0,0,0,-0.4939
3,Liberal,that president elect donald trump and his cabinet will cause unfixable damage to this earth and its citizens,0,0,0,2,0,0,0,0,0,-0.4939
3,Conservative,that donald trump is president,0,1,,2,,1,1,1,1,0
3,Very liberal,what the donald trump administration will do,0,0,,4,,0,0,0,0,0
3,Moderate,donald trump is the new president,0,0,,1,,1,1,0,1,0
3,Liberal,donald trump being president with all of the terrible cabinet members he chose,0,0,0,3,0,0,0,0,0,-0.4767
3,Very liberal,im worried about what will come with donald trump presidency especially when it comes to civil rights and social issues,0,0,1,5,0,0,0,0,0,-0.296
3,Liberal,how donald trump will deal with any of the problems we have,0,0,0,1,0,0,0,0,0,-0.4019
3,Moderate,that donald trump is going to be our countrys president,0,0,,3,,1,0,1,0,0
3,Very liberal,donald trump gop policies,0,0,,1,,0,0,0,0,0
3,Liberal,donald trump lack of political knowledge and bad behavior,0,0,0,3,0,0,0,0,0,-0.7003
3,Liberal,that donald trump will repeal barack obama care,0,0,,2,1,1,1,0,0,0.4939
3,Moderate,president donald trump oh god help us all,0,0,1,1,1,1,1,1,1,0.5859
3,Moderate,donald trump being our leader,0,0,,3,,1,1,0,0,0
3,Very liberal,donald trump as president,0,0,,4,,0,0,0,0,0
3,Very liberal,that donald trump will destroy the world if he isnt stop,0,0,0,1,0,0,0,0,0,-0.3843
3,Very liberal,donald trump in the proximity of the nuclear football presidential approval of hate crimes and sexual assault republican control of the house senate and supreme court leading to laws all over the nation codifying bigotry and income inequality worsening and leading to economic catastrophe global environmental catastrophe worsening of global war and conflict as the u s fails to provide meaningful leadership increased terrorism in response to pro torture and anti muslim policies and rhetoric,0,0,0,5,0,0,0,0,0,-0.9861
3,Very liberal,donald trump,0,0,,1,,0,0,0,0,0
3,Very liberal,donald trump,0,0,,5,,0,0,0,0,0
3,Liberal,donald trump,0,0,,1,,0,0,0,0,0
3,Very liberal,donald trump and his supporters thinking they get a free ride for hatred,0,0,1,3,1,0,0,0,0,0.25
3,Very liberal,donald trump presidency specifically his naming of white nationalists to important posts,0,0,,1,1,0,0,0,0,0.2023
3,Liberal,donald trump as president,0,0,,1,,0,0,0,0,0
3,Liberal,donald trump as president,0,0,,2,,0,0,0,0,0
3,Moderate,donald trump has no experience in this field we can only hope he makes the right choices,0,0,1,3,1,1,1,1,0,0.1779
3,Liberal,donald trump lack of leadership qualities and the people who surround him,0,0,0,2,0,0,0,0,0,-0.3182
3,Liberal,the incredible number of people that voted for donald trump,0,0,,3,1,1,1,1,1,0.1513
3,Very liberal,donald trump humiliating the u s,0,0,0,2,0,0,0,0,0,-0.296
3,Very conservative,donald trump leadership abilities,0,0,,3,1,1,1,1,1,0.25
3,Not sure,that the media will still run donald trump name through the mud like they did during the election i was very disappointed and a shamed that i watched abc channel and nbc channel and cbs channel and cnn channel plus read the washington post and the new york times i couldnt believe how they treated him but they praised and hillary clinton with all of her baggage im still a shamed,0,1,0,2,0,0,0,1,1,-0.5182
3,Liberal,president donald trump,0,0,,1,,1,1,1,1,0
3,Conservative,how the liberal will continue to try to stop donald trump and tear down this country,0,1,0,2,0,0,0,1,1,-0.296
3,Very conservative,im worried about donald trump friendliness with vladimir putin,0,0,,1,1,0,0,0,0,0.2023
3,Very liberal,donald trump has nazis in his cabinet,0,0,,1,,0,0,0,0,0
3,Liberal,donald trump being an unfit president,0,0,0,2,,0,0,0,0,0
3,Moderate,donald trump is a lunatic with no political experience he cant even lead his own life multiple bankruptcies multiple marriages and people actually thought he could lead a country !,0,0,0,1,0,0,0,0,0,-0.69
3,Liberal,the uncertainty of a donald trump presidency and the appointment of his advisors,0,0,0,2,0,0,0,0,0,-0.34
3,Moderate,donald trump unpredictability,0,0,0,4,,0,0,0,0,0
3,Moderate,donald trump has no diplomacy im afraid of what he will do to our relations with other countries he has no idea how important it is he is going to bulldoze himself right through them all,0,0,0,1,0,1,0,1,0,-0.3818
3,Moderate,donald trump is president,0,0,,4,,1,1,1,1,0
3,Liberal,a donald trump presidency,0,0,,5,,0,0,0,0,0
3,Conservative,big mouth donald trump will get us into a war and ruin the economy,0,0,0,4,0,0,0,0,0,-0.8271
3,Very liberal,donald trump and his cronies running the government,0,0,,3,,0,0,0,0,0
3,Not sure,donald trump becoming the president elect im fearful of losing my healthcare im also fearful of what will happen with the supreme court,0,0,0,2,0,0,0,0,0,-0.6597
3,Moderate,i worry that the drumpf donald trump will bring the u s into a global conflict that never should have even started a war with an neutral or hostile nation because of a tweet he didnt like him abusing the powers of the presidency him ruining relations with foreign nations because they are of a culture he just doesnt like or they are too ethnic for his delicate eyes in general its the large magnitude of uncertainty that we are all facing that worries me drumpf donald trump has proven through his many failed enterprises that he isnt a man of honor every single president needs to be honorable in one way or another to have the trust of the people that put him in office and the trust of the foreign nations that his predecessors worked so hard to earn for this country one example is mexico they have never been a threat to the u s since the mexican american war that was almost 170 years ago they have played along with every single rule the u s imposes and now the people living on the border on the u s side who heavily depend on trade with mexico are now feeling their livelihood threatened because of the drumpf donald trump policies i worry tourism will feel the tug as well with the drumpf donald trump fueling white supremacy groups nobody will want to come to the u s unless they absolutely must that will be a massive impact on the economy since international tourists will actively avoid visiting the u s out of distaste or fear,0,0,0,2,0,0,0,0,0,-0.9264
3,Moderate,donald trump,0,0,,1,,0,0,0,0,0
3,Liberal,donald trump will make america even more bigoted than it already is and we will be the laughing stock of the planet,0,0,0,3,1,0,0,0,0,0.4939
3,Moderate,donald trump destroying obamacare and his supreme court appointees,0,1,0,4,,0,0,0,0,0
3,Liberal,donald trump doesnt know what hes doing we will be at war or nuclear attack,0,0,0,3,0,0,0,0,0,-0.7906
3,Conservative,the democratic party is going to try to make everything donald trump tries look wrong,0,1,0,5,0,0,0,1,1,-0.1027
3,Moderate,donald trump isnt going to be good,0,0,1,5,1,1,0,0,0,0.4404
3,Moderate,how donald trump will mess up the u s,0,0,0,1,0,0,0,0,0,-0.3612
3,Liberal,donald trump presidency,0,0,,4,,0,0,0,0,0
3,Liberal,a cabal of racist sexist homophobic xenophobes are taking ultimate power in this country the united states is doomed anything that once made this country great is out the window if donald trump is placed in office,0,0,0,1,0,1,0,0,0,-0.3182
3,Moderate,democrats not accepting donald trump as president,0,1,1,1,0,0,0,1,1,-0.2924
3,Liberal,im worried about donald trump being president im worried about his appointments including supreme court justices i worry about his followers and their hate i worry about the environment,0,0,0,4,0,0,0,0,0,-0.8519
3,Liberal,the violence in this country with the police children so afraid to go to school that donald trump is going to really make our leaders in other countries angry with us,0,0,0,4,0,0,0,0,0,-0.8126
3,Liberal,president donald trump,0,0,,5,,1,1,1,1,0
3,Moderate,donald trump and our government,0,0,,1,,0,0,0,0,0
3,Liberal,donald trump will use the presidency to punish people who dont agree with him,0,0,,5,0,0,0,0,0,-0.6715
3,Moderate,im extremely bothered by the mutinous behavior exhibited by the majority of the press and concerned it wont give donald trump a fair chance to do his job,0,1,0,2,1,0,0,0,0,0.1796
3,Conservative,that the naysayers are more interested in proving their contention that donald trump isnt capable than they are in being supportive and giving him a chance that they will try to undermine him at every opportunity instead of getting on board and looking at the bigger picture improving our government and our country its economy its ability to protect itself against those who wish it harm im praying they will love america more than they are interested in proving donald trump cant do a good job,0,1,1,2,1,0,0,1,1,0.9633
3,Liberal,that donald trump wont know what he is doing,0,0,,2,,0,0,0,0,0
3,Liberal,donald trump will wreck the joint,0,0,0,4,0,0,0,0,0,-0.4404
3,Not sure,if donald trump stays president,0,0,,2,,0,0,0,0,0
3,Very liberal,that more bigotry and hate will become commonplace and normalized i also fear for those who dont agree with donald trump and are retaliated against,0,0,0,4,0,0,0,0,0,-0.8509
3,Very liberal,the potential that donald trump wont follow through with the promises he made during his campaign,0,1,,3,1,1,0,1,1,0.3818
3,Moderate,not knowing what will happen once donald trump is in office,0,0,,3,,0,0,1,0,0
3,Liberal,donald trump,0,0,,5,,0,0,0,0,0
3,Very liberal,donald trump advisors mike pence the white supremacist guy whose name starts with b,0,0,,4,1,0,0,0,0,0.128
3,Moderate,that donald trump is too eager to stir up things with our allies,0,0,,4,1,0,1,0,0,0.3612
3,Very liberal,having donald trump as our president makes me ashamed to be an american,0,0,0,2,0,0,0,0,0,-0.4767
3,Liberal,donald trump being our commander and chief,0,0,,4,,0,1,0,1,0
3,Very liberal,the right wing extremism within the donald trump staff,0,0,,3,,0,0,0,0,0
3,Moderate,racism bigotry donald trump temper,0,0,0,5,0,0,0,0,0,-0.7845
3,Moderate,donald trump,0,0,,4,,0,0,0,0,0
3,Conservative,the media bashing donald trump and the protests,0,1,0,5,0,0,0,1,1,-0.2263
3,Liberal,donald trump,0,0,,4,,0,0,0,0,0
3,Liberal,if donald trump isnt taken out of office,0,0,,3,,1,1,0,0,0
3,Moderate,donald trump presidency,0,0,,3,,0,0,0,0,0
3,Very liberal,everything about the donald trump administration,0,0,,3,,0,0,0,0,0
3,Very liberal,environmental devastation if donald trump follows up on his campaign pledges,0,0,,2,0,1,0,0,1,-0.4215
3,Moderate,about the racism and not having a politician commanding this country and the intolerance of donald trump,0,0,0,3,0,0,0,0,0,-0.6249
3,Liberal,donald trump,0,0,,3,,0,0,0,0,0
3,Moderate,president elect donald trump inexperience,0,0,0,3,,1,0,0,0,0
3,Conservative,how donald trump will handle foreign affairs,0,0,,4,,0,0,0,0,0
3,Moderate,terrorism police killing us and donald trump moving in the white house next year will we still have obamacare and illegal aliens out put up those borders,0,0,0,4,0,1,0,1,1,-0.9274
3,Liberal,donald trump supreme court picks his pledge to privatize read doom social security his pledge to reverse roe v wade his pledge to define planned parenthood his pledge to destroy the epa his nonsense about building the wall between us and mexico literally everything he has said and promised makes me ill,0,0,,5,0,0,0,0,0,-0.4939
3,Liberal,donald trump,0,0,,3,,0,0,0,0,0
3,Moderate,to have a man like donald trump in charge not paying taxes bankruptcies and lawsuits he most likely will give himself amnesty,0,0,0,4,1,1,0,1,0,0.2263
3,Very liberal,donald trump being president,0,0,,3,,0,0,0,0,0
3,Very liberal,donald trump and his cronies racism bigotry etc,0,0,0,4,0,0,0,0,0,-0.6249
3,Liberal,donald trump,0,0,,4,,0,0,0,0,0
3,Liberal,donald trump is president,0,0,,3,,1,1,1,1,0
3,Liberal,donald trump,0,0,,5,,0,0,0,0,0
3,Moderate,a donald trump presidency and his choosing of cabinet its looking more and more like the swamp is getting filled with snakes no change in washington !,0,0,1,1,1,1,0,0,0,0.2843
3,Liberal,everything about donald trump racism in america,0,0,0,3,0,0,0,0,0,-0.6249
3,Liberal,donald trump as president,0,0,,3,,0,0,0,0,0
3,Moderate,donald trump,0,0,,1,,0,0,0,0,0
3,Liberal,donald trump becoming our president he is going to be the head of our country i fee like im living in an alternate universe full of morons and bigots,0,0,0,5,1,1,0,0,0,0.0516
3,Moderate,donald trump,0,0,,2,,0,0,0,0,0
3,Moderate,donald trump republicans,0,0,,5,,0,0,0,0,0
3,Very conservative,jobless not being able to take care of families and their kids scared that kids might go to school and come home and their parents might b gone as donald trump has said,0,0,,4,1,0,0,0,0,0.0772
3,Not sure,donald trump decisions,0,0,,5,,0,0,0,0,0
3,Moderate,the direction donald trump election will take us and the uncertainty of what he will wont due next,0,0,0,2,0,0,0,0,0,-0.34
3,Liberal,donald trump turkey vladimir putin president duterte,0,0,,1,,0,0,0,0,0
3,Moderate,donald trump,0,0,,2,,0,0,0,0,0
3,Conservative,donald trump,0,0,,2,,0,0,0,0,0
3,Moderate,donald trump racist policies,0,0,0,5,0,0,0,0,0,-0.6124
3,Moderate,president donald trump is my biggest worries in where this country is heading,0,0,0,1,0,0,0,1,0,-0.4215
3,Liberal,donald trump,0,0,,3,,0,0,0,0,0
3,Not sure,donald trump,0,0,,3,,0,0,0,0,0
3,Moderate,the people that donald trump is appointing to his closest circle,0,0,,4,,0,0,0,0,0
3,Very liberal,im worried that any progress made over the past eight years will be undone by donald trump and his administration,0,0,0,5,1,0,0,0,0,0.1531
3,Very liberal,donald trump and mike pence,0,0,,1,,0,0,0,0,0
3,Liberal,donald trump,0,0,,4,,0,0,0,0,0
3,Conservative,the way people have been reacting to donald trump being our next president isis and all the terrorist groups who want americans dead,0,1,0,3,0,0,0,0,0,-0.8658
3,Not sure,donald trump,0,0,,1,,0,0,0,0,0
3,Moderate,the damage that donald trump and his cronies can do in four years,0,0,0,4,0,0,0,0,0,-0.4939
3,Very liberal,donald trump presidency,0,0,,3,,0,0,0,0,0
3,Liberal,donald trump being president,0,0,,2,,0,1,0,0,0
3,Very liberal,i worry that with donald trump mike pence as potus and vice president respectively a republican controlled congress and a supreme court that will likely lean conservative after donald trump pushes through his appointment to replace antonin scalia i find it very likely that a lot of the social progress made under barack obama presidency will be reversed,0,0,0,1,1,0,0,0,0,0.7096
3,Liberal,the cabinet donald trump is selecting to surround himself with,0,0,,1,,0,1,0,0,0
4,Moderate,barack obama started a negative racial division in the u s which i believe he will become another al sharpton behind the scenes instigating violent riots there is too much jealousy against donald trump and many democrats will hinder progress donald trump has to get extremely tough on violent protesters giving police full backup to warn then shoot barack obama allowed violent riots and this will continue unless deadly force is used on them,0,1,0,3,0,0,0,1,1,-0.9773
4,Liberal,our president,0,0,,4,,1,0,1,1,0
4,Moderate,donald trump and steve bannon,0,0,,4,,0,0,0,0,0
4,Moderate,that the president wont be able to put forth his agenda because of the liberal courts senators and left wing hate groups that only seek to destroy this great country,0,1,0,5,0,0,0,1,1,-0.3237
4,Not sure,donald trump,0,0,,1,,0,0,0,0,0
4,Moderate,what worries me the most about the next 12 months is the loss of most if not all the advances made in womens rights mr donald trump hates women he is going to shove his anti woman agenda down our throats and set us back to the barefoot and pregnant days,0,0,0,3,0,0,0,0,0,-0.8519
4,Not sure,donald trump doesnt seem to care about the environment and cares too much about big oil which we so desperately need to move away from im scared for the future of our protected lands and animals,0,0,,3,0,0,0,0,0,-0.4578
4,Moderate,the divide in our country the ignorance that causes people to hate each other everything about donald trump,0,0,0,4,0,0,0,0,0,-0.7351
4,Moderate,donald trump is still president,0,0,,2,,0,0,0,0,0
4,Liberal,our president is very scary,0,0,0,5,0,0,0,0,0,-0.5413
4,Moderate,our presidents attitude and reactions his overall being,0,0,,1,,0,0,0,1,0
4,Moderate,that the republicans will be to afraid to hold the president accountable,0,0,,2,,1,0,0,0,0
4,Conservative,donald trump,0,0,,5,,0,0,0,0,0
4,Moderate,the way our president talks about the media and his hateful mouth,0,0,0,4,0,0,0,1,1,-0.4939
4,Liberal,the growing abuse of basic constitutional rights by the white house,0,0,,2,0,0,0,0,0,-0.5423
4,Very liberal,president donald trump,0,0,,5,,1,1,1,1,0
4,Very liberal,donald trump disastrous policies that may take years or even decades to recover from,0,0,,2,0,0,0,0,0,-0.5994
4,Liberal,the attack on the press the cruelty and fear the administration has introduced into the lives of undocumented aliens who have been in the country for years contributing to the economy and paying taxes the congress has refused to pass an immigration program that would give these people the chance to become citizens we are all immigrants and i wish the republicans ancestors would have had to go through the donald trump vetting process they wouldnt be here !,0,0,0,5,0,0,0,1,0,-0.8398
4,Moderate,im really worried about what hes doing as president,0,0,0,3,0,0,0,0,0,-0.3597
4,Moderate,that donald trump will bankrupt us,0,0,0,5,0,0,0,0,0,-0.5574
4,Moderate,as a senior citizen im most worried about medicare drug insurance coverage and the cost of drugs social security and also the fear of this president and congress causing much disturbance around the world and getting us into another war or even nuclear war,0,0,0,4,0,0,0,0,0,-0.9286
4,Moderate,donald trump unstableness,0,0,0,1,,0,0,0,0,0
4,Conservative,that the president will be stopped from making beneficial changes by congress also that the haters will get violent and destroy public and private property,0,1,0,5,0,0,0,1,1,-0.8625
4,Liberal,donald trump and congress will ignore the majority wishes and continue living in an echo chamber,0,0,0,2,0,0,0,0,0,-0.2263
4,Liberal,no one in the government seems willing to apply the laws to the president even though he is breaking many there appears to be no checks and balances in our government,0,0,,2,0,1,0,0,0,-0.5267
4,Very liberal,the overall uncertainty of not knowing what donald trump or the gop might try to do policy wise,0,0,,1,1,0,0,0,0,0.1779
4,Liberal,donald trump and his ilk will destroy everything that has been accomplished and put us back to the 1940s,0,0,,4,0,0,0,0,0,-0.1531
4,Moderate,donald trump,0,0,,5,,0,0,0,0,0
4,Liberal,donald trump and mike pence and republicans in general,0,0,,5,,0,0,0,0,0
4,Very liberal,donald trump presidency,0,0,,4,,0,0,0,0,0
4,Moderate,the poor approval rating of the president,0,0,,5,,0,0,0,0,0
4,Moderate,donald trump is going to destroy the environment,0,0,0,3,0,0,0,0,0,-0.5423
4,Very liberal,donald trump steve bannon mike pence jeff sessions betsy devos reince priebus toomey and murphy are dangerous people who intend to drive this country into the ground with the help of unchallenged alternate facts,0,0,,1,0,0,0,0,0,-0.1027
4,Very conservative,donald trump being stifled by the establishment and media,0,1,0,3,0,0,0,1,1,-0.34
4,Liberal,corruption in the white house,0,0,0,5,,0,0,0,0,0
4,Conservative,democrats trying to derail the job of president donald trump,0,1,0,4,0,0,0,1,1,-0.296
4,Moderate,news media lies donald trump haters,0,1,0,3,0,0,0,1,0,-0.7184
4,Conservative,people bankrolling and being community organizer against the president,0,1,0,5,,1,1,0,0,0
4,Very conservative,what worries me is that i wonder if anything positive can come out of the new office commander building walls sending people away lies cheating racism crime and our children seeing this there are no role models for them or us even imagine the londoners dont want the president to visit what a mess,0,1,0,4,0,0,0,0,0,-0.9526
4,Conservative,what worries me most is the extreme opposition to everything that president donald trump does,0,1,0,3,0,0,0,0,1,-0.4215
4,Not sure,the president,0,0,,4,,0,0,0,0,0
