wavenum,ideo5,edits_clean_text,qpos,trump_stance_auto,lexicoder_sentiment,fold,vader_sentiment,SVM_sentiment,BERT_sentiment,SVM_stance,BERT_stance,vader_scores
8,Moderate,donald trump and his administration,0,0,,4,,0,0,0,0,0
8,Moderate,everything donald trump,0,0,,5,,0,0,0,0,0
8,Very liberal,income inequality racism donald trump,0,0,0,3,0,0,0,0,0,-0.6249
8,Liberal,donald trump,0,0,,4,,0,0,0,0,0
8,Moderate,the way donald trump is messing up the u s and the world,0,0,0,2,,0,0,0,0,0
8,Liberal,not being able to work together to solve problems the president for one,0,0,0,5,0,1,0,1,1,-0.2263
8,Conservative,democrats think they should have won the election so will do everything possible to obstruct the president and the congress,0,1,,1,1,0,0,1,1,0.5719
8,Moderate,the donald trump administration,0,0,,2,,0,0,0,0,0
8,Conservative,donald trump the lies the racism and our congress and senate are complicit in our election and now they all took a pledge to our constitution paul ryan and mitch mcconnell is there 1 honest republican the u s is at an all time low this is sad and dangerous !,0,0,0,5,0,0,0,0,0,-0.9041
8,Moderate,the good old boys in congress and the most disgraceful president in u s history who is making a farce out of this country,0,0,,1,1,1,0,1,0,0.0516
8,Liberal,the fact that donald trump is still president,0,0,,1,,0,0,0,0,0
8,Moderate,the republican party sitting by and doing nothing as donald trump single handedly destroys the country makes me feel angry,0,0,0,5,0,0,0,0,0,-0.6369
8,Moderate,donald trump,0,0,,5,,0,0,0,0,0
8,Moderate,having donald trump as president,0,0,,4,,0,0,0,0,0
8,Liberal,donald trump,0,0,,2,,0,0,0,0,0
8,Very conservative,the democrats refusal to accept the fact the donald trump beat hillary clinton and their asinine resistance movement as barack obama said election have consequences,0,1,0,2,1,1,0,0,0,0.3818
8,Conservative,yes like i mentioned before the politicians have been acting like children they dont care about the people they serve they are more worried about getting reelected and or opposing donald trump many make a fortune off the backs of the american people without serving them,0,1,1,4,1,0,0,0,1,0.3354
8,Moderate,donald trump and his cult,0,0,0,5,,0,0,0,0,0
8,Liberal,lowlife tendencies of conservatives fueled by a president who will go down in history as one of the worst americans of all time,0,0,0,1,0,0,0,1,1,-0.765
8,Moderate,donald trump,0,1,,3,,0,0,0,0,0
8,Very liberal,the misinformation constantly generated by donald trump and his supporters,0,0,1,1,1,0,0,0,0,0.1531
8,Liberal,donald trump the republican party selling their soul to grab what they can while they can,0,0,0,5,1,0,0,1,0,0.4019
9,Moderate,im so tired of hearing the decisive rhetoric im sick of the drive bye media the elite media promoting and making up bad stories about the president and the government which reflects directly on our country it makes me very angry,0,1,0,1,0,0,0,1,1,-0.8803
9,Very conservative,the parties not working together they just dont like the president so wont do anything to make it better for the seniors and working people they want illegal people to get everything free when i and my family had to work for it and pay for everything now have to worry i wont survive,0,1,1,5,1,0,0,1,1,0.049
9,Very liberal,donald trump,0,0,,4,,0,0,0,0,0
9,Moderate,donald trump,0,0,,1,,0,0,0,0,0
9,Conservative,the democrats who wont work with president donald trump as soon as the house one yesterday one of the leaders called the news agency and said the first thing on the list is to impeach donald trump this decisiveness is very upsetting and annoying all we ask is they work with the president he won he is president now work with him,0,1,,3,0,1,0,1,1,-0.3933
9,Very liberal,donald trump,0,0,,4,,0,0,0,0,0
9,Conservative,i know the vast majority of american citizens in my area are totally fed up with the disgusting behavior of the democrats the resistance crap and vile hatred spewed forth by the democrats is hurtful to the entire nation and very insulting to americans if democrats dont want to work for the good of america they need to go home and let another represent their constituents with honor and respect and work with all legislators and the president,0,1,0,3,0,0,0,1,1,-0.9219
9,Liberal,our president,0,0,,1,,1,1,1,0,0
9,Liberal,donald trump in the white house,0,0,,4,,0,1,0,1,0
9,Liberal,donald trump isnt a fit president and he isnt doing nothing for the poor,0,0,,2,1,0,0,0,0,0.1139
9,Very conservative,the democrats go against anything and everything the president does or says,0,1,0,1,,0,0,0,1,0
9,Very liberal,donald trump and money in politics,0,0,,1,,0,0,0,0,0
9,Moderate,division social inequity corrupt funding super pacs the fact that donald trump is president inaction in congress attacks on the press attacks on free speech,0,0,0,3,1,0,0,0,0,0.1027
9,Moderate,donald trump and republicans,0,0,,4,,0,0,0,0,0
9,Very liberal,donald trump,0,0,,2,,0,0,0,0,0
9,Moderate,having donald trump as our president,0,0,,5,,0,1,0,0,0
9,Liberal,the way the president acts and divides people,0,0,0,4,,0,0,0,0,0
9,Moderate,very closed attitude if you arent a white male with money the president has mocked women minorities immigrants lgbt disabled and low income just to name a few he has mocked those who have suffered bullying and abuse yet there are many elected officials who havent stood up and said enough,0,0,0,4,0,0,0,0,0,-0.9517
9,Moderate,increasing division misinformation campaigns negative campaigning voter suppression villainization of the media increased untruthfulness from politicians brazen lies from the presidents cabinet unwillingness to listen to and work across the aisle,0,0,0,2,0,0,0,0,0,-0.7717
9,Moderate,we have an unqualified lunatic in the white house,0,0,0,5,0,0,0,0,0,-0.4939
9,Very liberal,our dreadful president and no republican being strong enough to stand up to him,0,0,,5,0,1,0,0,0,-0.2023
9,Liberal,the president and his lack of decorum for his critical role as a major leader in the world his constant lying and words actually incite others to treat others horribly i wish both parties could unite to to what is best for the country not whats only in it for their party,0,0,0,3,1,0,0,1,0,0.5574
9,Moderate,the president chided the republican candidates who lost their election because they didnt want his help,0,0,0,2,0,0,0,1,0,-0.5831
9,Liberal,donald trump and cheating lying republicans,0,0,0,4,0,0,0,0,0,-0.7906
9,Very liberal,republicans n donald trump,0,0,,4,,0,0,0,0,0
9,Very conservative,the way the mainstream media treats the president,0,1,,1,,0,0,1,1,0
9,Moderate,that the gop has decided that donald trump is more important than the u s they are putting party before country,0,0,,5,1,0,1,0,0,0.5849
9,Conservative,our president being constantly attacked,0,1,0,1,0,0,0,1,0,-0.4588
9,Moderate,our president,0,0,,3,,1,0,1,0,0
9,Moderate,donald trump and the republicans who support him the new supreme court justice because of his lying and view of women gerrymandering in many states currently the georgia governors election the minorities and native americans being hindered from voting the non reporting of these actions,0,0,0,3,1,0,0,0,0,0.743
9,Very liberal,donald trump lies and manipulations the fact that people cant think for themselves and vote along party lines without regard for the actual effects,0,0,1,5,0,0,0,0,0,-0.0258
9,Liberal,donald trump and republicans !,0,0,,4,,0,0,0,0,0
9,Very liberal,the divisive politics of our president and the way the republicans have cowered and supported him im angry that the politics of this president and republicans in senate and house have used race and hatred to divide our country,0,0,0,5,0,0,0,0,0,-0.7351
9,Liberal,the ignorance of most of the americans our president who lies constantly and doesnt care about all americans most of the gop that again as an entity cares little for independent and more liberal americans cares more for making sure they and large corps have plenty of money and they care very little about the poor how we are isolated from the rest of the world and how we arent respected that russia interfered with the election that russia is considered by donald trump as a good alliance in short pretty much everything about politics makes me angry,0,0,1,4,1,0,0,0,0,0.0539
9,Very liberal,all of it but mostly donald trump getting elected,0,0,,3,,1,0,1,0,0
9,Moderate,donald trump,0,0,,3,,0,0,0,0,0
9,Very liberal,the big polarization between the rural population and the urban areas when the first support a dishonest donald trump and the second ones support a democratic change,0,0,,1,1,0,0,0,0,0.1779
9,Very liberal,donald trump,0,0,,3,,0,0,0,0,0
9,Very liberal,everything about the donald trump administration to include but not limited to the separation of families at the border the incitement to violence by a racist president the abdication of americas role as a moral authority in the world the continual lying of the president,0,0,0,2,0,0,0,0,0,-0.946
9,Very conservative,the resistance of the democratic party to any action our president tries to take angers me,0,1,0,4,0,1,0,0,1,-0.1531
9,Liberal,donald trump and republicans,0,0,,1,,0,0,0,0,0
9,Liberal,donald trump the republican party and the corruption in politics,0,0,0,1,1,0,0,0,0,0.4019
9,Moderate,donald trump revoking the reporters credentials donald trump border wall donald trump sending soldiers to the border and asking them to shoot at migrants donald trump hatred for minorities and people in poverty,0,0,0,5,0,0,0,0,0,-0.872
9,Very liberal,donald trump,0,0,,2,,0,0,0,0,0
9,Liberal,our president is inept he knows nothing about our constitution donald trump is dishonest and a racist he is against women having any power,0,0,0,1,0,0,0,0,0,-0.8271
9,Very liberal,donald trump behavior republican complicity treatment of immigrant children tax scam done in the middle of the night brett kavanaugh appointment voter purges in red states,0,0,,1,0,0,0,0,0,-0.5719
9,Very conservative,angry obsessed people that refuse to spend their political capital helping the president to keep this country on the right track,0,1,,4,0,0,0,1,1,-0.6124
9,Very conservative,the anger the lack of support for our president that was legally voted into office and the disregard for the welfare of the people,0,1,0,5,0,0,0,0,0,-0.6124
9,Moderate,the negative comments from others about our president,0,1,0,2,0,0,0,0,1,-0.5719
9,Moderate,the divided parties no one gets along and there is so much hate against the president,0,1,0,4,0,0,0,0,1,-0.539
9,Very liberal,people being willfully ignorant about donald trump and the republicans,0,0,0,5,0,0,0,0,0,-0.2732
9,Liberal,our president the great divide between people lies corruption greed,0,0,0,1,0,0,0,0,0,-0.1027
9,Liberal,the amount of idiots that will believe anything that comes out of donald trump mouth,0,0,0,3,,0,0,0,0,0
9,Moderate,donald trump !,0,0,,5,,0,0,0,0,0
9,Liberal,rudeness name calling and president donald trump general behavior especially the constant lies,0,0,0,5,0,0,0,0,0,-0.6771
9,Moderate,the racist piece of s    person currently holding the office of president has destroyed the republican party the republican party has no moral compass an no moral authority anymore,0,0,,2,0,0,0,0,0,-0.7523
9,Very liberal,donald trump and white nationalists,0,0,,3,,0,0,0,0,0
9,Liberal,everything donald trump racist fear mongering divisive anti women and right wing,0,0,0,2,0,0,0,0,0,-0.8834
9,Moderate,donald trump and is gang,0,0,0,4,,0,0,0,0,0
9,Moderate,divisive figures in power too much corruption especially given citizens united decision donald trump and gop needs to be blown up and retool the entire party,0,0,0,2,1,0,0,0,0,0.6969
9,Moderate,donald trump lying and acting childish,0,0,0,5,0,0,0,0,0,-0.6808
9,Liberal,all of the gun violence donald trump in general,0,0,0,4,0,0,0,0,0,-0.7579
9,Very liberal,the racist ignorant bigot in the white house,0,0,0,1,0,0,0,0,0,-0.7269
9,Liberal,donald trump,0,0,,3,,0,0,0,0,0
9,Not sure,the way the rules are working for donald trump but barack obama has to bend over backwards,0,0,0,4,,0,0,1,1,0
9,Very liberal,donald trump paul ryan mitch mcconnell the nra and ultra rich corporations not paying taxes and destroying our planet,0,0,,4,,0,0,0,0,0
9,Moderate,donald trump,0,0,,3,,0,0,0,0,0
9,Very liberal,that the republican party has embraced racism homophobia and fear mongering that the democratic party has no platform for voters to connect with that voter suppression and gerrymandering continue the blatant corruption of donald trump his family and the republican party the constant attacks on the constitution and the continued efforts to deny protection to and rollback basic human rights for minorities,0,0,0,5,0,0,0,0,0,-0.8176
9,Very liberal,donald trump his administration and policies,0,0,,3,,0,0,0,0,0
9,Very liberal,donald trump policies,0,0,,2,,1,1,1,0,0
9,Moderate,donald trump,0,0,,1,,0,0,0,0,0
9,Very conservative,democrats double standards and hypocrisy along with their lies and outright destructive actions against the president,0,1,0,1,0,0,0,0,1,-0.7783
9,Very liberal,donald trump,0,0,,3,,0,0,0,0,0
9,Liberal,donald trump and the rest of the dirty republicans,0,0,0,4,0,0,0,0,0,-0.4404
9,Very conservative,democrats always opposing donald trump on everything,0,1,0,3,,0,0,1,1,0
9,Moderate,donald trump,0,0,,5,,0,0,0,0,0
9,Very liberal,donald trump,0,0,,1,,0,0,0,0,0
9,Very liberal,donald trump,0,0,,2,,0,0,0,0,0
9,Liberal,our immature president damaging our reputation around the world,0,0,0,2,0,0,0,0,0,-0.5106
9,Moderate,people like donald trump can lie and bully their way into office without being punished,0,0,0,5,1,0,0,0,0,0.1974
9,Very conservative,the democrats have said they would do everything they could to impeach the president and justice brett kavanaugh and the people of new york elected a moron from the 14th district,0,1,0,3,1,0,0,0,0,0.0516
9,Liberal,donald trump is racist and doesnt care too much about the lower and middle class,0,1,0,1,0,0,0,0,0,-0.8329
9,Liberal,donald trump,0,0,,4,,0,0,0,0,0
9,Moderate,the president speeches,0,0,,2,,1,1,1,1,0
9,Liberal,the lack of a president,0,0,0,1,0,0,0,0,0,-0.3182
9,Liberal,the president,0,0,,5,,0,0,1,0,0
9,Liberal,donald trump and the white nationalists and white supremacist that he attracts,0,0,1,2,1,0,0,0,0,0.4939
9,Very liberal,donald trump craziness and policies,0,0,0,1,0,0,0,0,0,-0.3818
9,Very conservative,the way donald trump is toying with the country and caring about healthcare except money,0,0,1,5,1,0,0,0,0,0.4939
9,Conservative,the constant degrading of our president and the bickering of the democratic party with the republican party the lack of trust being sewn by the media the constant fake news,0,1,0,2,0,0,0,1,1,-0.128
9,Conservative,how donald trump is setting the world up for failure,0,0,0,3,0,0,1,0,0,-0.5106
9,Very liberal,donald trump and immigration policies,0,0,,4,,0,0,0,0,0
9,Very liberal,republicans who support the asinine antics of donald trump,0,0,,4,1,0,0,0,0,0.4019
9,Conservative,the president of the united states of america and the violence,0,1,,5,0,0,0,0,0,-0.3182
10,Liberal,everything that donald trump lies about,0,0,,5,0,0,0,0,0,-0.4215
10,Moderate,donald trump,0,0,,5,,0,0,0,0,0
10,Liberal,mr donald trump and republican senators also the followers,0,0,,2,,0,0,0,0,0
10,Moderate,donald trump,0,0,,4,,0,0,0,0,0
10,Moderate,president donald trump and mitch mcconnell mitch mcconnell work to destroy democracy in our government,0,0,0,1,0,0,0,0,0,-0.5423
10,Liberal,the fact that we have a president afflicted with willful ignorance who also happens to be a racist,0,0,0,2,0,0,0,0,0,-0.8402
10,Very liberal,the hate and derision that comes from our president,0,0,0,2,0,0,0,0,0,-0.7096
10,Conservative,trashing the president immigration speaker of the house against the wall sanctuary cities and states the democrats are more concerned about illegals then americans the caravans at the border and more coming,0,1,0,4,,1,0,1,1,0
10,Moderate,the awful conservative and hateful trend brought about by donald trump,0,0,0,1,0,0,0,0,1,-0.7351
10,Moderate,the incompetence of the president and his blatant disregard for americans as well as foreigners,0,0,0,1,0,0,0,0,0,-0.5106
10,Conservative,i cant stand that people are allowed to say such horrible things about our president even if they didnt vote him in they need to respect the office and what it stands for,0,1,1,5,0,0,0,0,1,-0.1027
10,Very liberal,the right wing lies in particular those coming from the mouth of donald trump,0,0,1,1,0,0,0,0,0,-0.4215
10,Moderate,that some legislators are ignoring deviations from the rule of law that they wouldnt have tolerated except for the personality of the president,0,0,,4,0,0,0,0,1,-0.4019
10,Liberal,all they care about both parties are big money interests and when will the republicans show some spine and stand up to this monster donald trump ?,0,0,,1,1,0,1,0,0,0.7845
10,Liberal,donald trump administration has been a total disaster for democracy and i include republican leadership in this,0,0,0,5,0,0,0,0,0,-0.659
10,Very liberal,donald trump,0,0,,3,,0,0,0,0,0
10,Very liberal,donald trump,0,0,,4,,0,0,0,0,0
10,Moderate,donald trump republicans,0,0,,1,,0,0,0,0,0
10,Liberal,our out of control president,0,0,0,3,,1,0,0,0,0
10,Moderate,everything about the corrupt russian puppet donald trump,0,0,0,5,,0,0,0,0,0
10,Liberal,donald trump and his running his mouth and twitter in a very unnatural way for a president republicans that wont stand up to him when they know he is wrong,0,0,0,2,0,0,0,0,0,-0.4767
10,Very liberal,the stupidity of our president the lack of cooperation and the waste of taxpayer dollars,0,0,0,4,0,0,0,0,0,-0.7906
10,Liberal,im angry and disgusted about the man who is now the president of the united states im angry that mitch mcconnell and the rest of the republicans now serving in congress allow the current president to keep lying day after day to gullible americans and do nothing to stop his ruining of our nation im angry and depressed that the current idiot of a president who i believe to be a narcissist a racist a serial adulterer and a traitor to our country still has people who support him he is morally bankrupt he has severely damaged our international reputation and brought us shame he has undone positive steps to help the environment and even worse decries climate change as a legitimate and very frightening issue he takes care of no one but himself and his base im angry and shocked that this liar is the president there is nothing presidential about him,0,0,0,5,0,0,0,0,0,-0.9813
10,Conservative,the constant ignoring by the media and by the democratic party of all of the positive outcomes especially from an economic perspective that have been achieved under the donald trump presidency,0,1,1,1,1,0,0,1,1,0.5574
10,Very liberal,the president,0,0,,5,,0,0,1,0,0
10,Very liberal,the lawlessness and corruption in by the person in the white house and his family aided and abetted by the gop in congress oh and the president is also a russian asset a traitor,0,0,0,4,1,0,0,0,0,0.3612
10,Liberal,donald trump brett kavanaugh literally almost everything that has happened in the last 2 years,0,0,,1,,0,0,1,0,0
10,Very conservative,democrats opposition to everything donald trump does or proposes to do lack of support within the republican party,0,1,0,5,1,0,0,0,0,0.4767
10,Very liberal,donald trump,0,0,,2,,0,0,0,0,0
10,Conservative,the constant president bashing,0,1,,5,,0,0,1,1,0
10,Liberal,our president and the republicans,0,0,,3,,0,1,0,1,0
10,Conservative,just against the democrats who absolutely hate president donald trump,0,1,0,2,0,0,1,1,1,-0.6115
10,Very liberal,because the president dont care about no one,0,0,1,2,0,0,0,0,1,-0.1877
10,Conservative,the resistance of the democrats not willing to cooperate on anything that involves our president,0,1,1,3,,1,1,1,1,0
10,Moderate,the childish antics of both parties nancy pelosi and her stupid remarks about the president the president and his childish rants the democratic party wants this country to become a communistic organ of the democrats no longer a republic but run by a dictator thank heavens ive lived a very long time and have gone through hard times and good times if the democrats have their way the young people of today will possibly survive some very difficult times if they take back this country from the idiots now in congress they have a chance to make this country strong once again my opinion !,0,1,0,4,1,0,0,1,1,0.8922
10,Very liberal,the president is still in office,0,0,,5,,0,0,0,0,0
10,Moderate,everything about the republicans and the president systemic racism and misogyny and the way the 99% are treated,0,0,0,2,0,0,0,0,0,-0.6249
10,Liberal,donald trump mismanagement,0,0,,2,,0,0,0,0,0
10,Moderate,donald trump,0,0,,2,,0,0,0,0,0
10,Liberal,donald trump and his family,0,0,,5,,0,0,0,0,0
10,Liberal,that woman voted for donald trump knowing how he treats woman,0,0,,1,,0,1,0,1,0
10,Moderate,donald trump ! election tampering hacking voter suppression purging registered voters gerrymandering russian influence foreign contributions corporation contributions citizens united and many other republican dirty tricks and laws,0,0,0,3,0,0,0,0,0,-0.2244
10,Liberal,the needless wall treatment of people seeking asylum separation of kids and parents fake border crisis ignoring science on climate change and the normalization of a president who lies,0,0,0,1,0,0,0,0,0,-0.9136
10,Liberal,the republican party and that moron in the white house,0,0,0,4,0,0,0,0,0,-0.128
10,Moderate,theres a criminal in the white house and we cant get rid of him,0,0,0,4,0,0,0,0,0,-0.5267
10,Moderate,the fighting politicians being for a program and then against it because they dont like the president if you cant help improve our country get out of the way we need term limits for every job in washington dc,0,1,,4,0,0,0,1,1,-0.806
10,Very liberal,donald trump,0,0,,1,,0,0,0,0,0
10,Very conservative,all of the lies and also how the democrats mainly nancy pelosi are treating the president,0,1,,3,0,0,0,0,1,-0.4215
10,Liberal,our president and the outrageous things he gets away with,0,0,0,1,0,0,0,0,0,-0.4588
10,Liberal,that so many american citizens didnt value their vote to stop and think through the values or lack of the man they elected to be our current president,0,0,0,5,0,0,0,0,0,-0.4284
10,Very liberal,donald trump,0,0,,4,,0,0,0,0,0
10,Moderate,cow towing to donald trump and his base,0,0,,5,,0,0,0,0,0
10,Liberal,political squabbles at the white house,0,0,,5,,0,0,0,1,0
10,Very liberal,donald trump the gop every pu  y who wont stand up to them,0,0,,1,0,0,0,0,0,-0.2732
10,Moderate,donald trump and his minions,0,0,,5,,0,0,0,0,0
10,Liberal,everything president donald trump does and stands for the fact that congress doesnt see themselves as a co equal branch of government that the media still allows a false equivalence between democrats and republicans that the media constantly talks about the middle without acknowledging that the right has moved so far right that the middle as they are trying to frame it no longer exists that the democrats still dont know how to have a media presence that the presidents cabinet is run by industry lobbyists that dont seem to care about the country,0,0,1,2,0,0,0,1,1,-0.5897
10,Moderate,the present president lack of knowledge of how a government should be run his child like behavior in shutting he government down not taking the law enforcement advise,0,0,1,1,1,0,0,0,0,0.0516
10,Very conservative,the democrats dont do anything just trying to bring this president down,0,1,,4,,0,0,1,1,0
10,Conservative,our president,0,0,,5,,1,1,1,0,0
10,Very conservative,the medias obvious slant to the left and not giving equal time to the great things donald trump has accomplished in his first two years,0,1,1,1,1,1,0,1,1,0.7153
10,Liberal,the children separated at the border and still not reunited with their families along with manufactured crisis by the president leading to the government shut down,0,0,0,5,0,0,0,0,0,-0.6249
10,Moderate,donald trump,0,1,,5,,0,0,0,0,0
10,Liberal,donald trump lying,0,0,0,1,0,0,0,0,0,-0.5267
10,Moderate,democrats are more interested in ruining the president than actually running the country and coming up with solutions,0,1,0,2,1,0,0,1,1,0.3462
10,Liberal,the president,0,0,,3,,0,0,1,0,0
10,Liberal,everything the idiot in the white house and his minions do makes me angry !,0,0,0,4,0,0,0,0,0,-0.784
10,Liberal,the lies and dishonesty of donald trump and the white house,0,0,0,2,0,0,0,0,0,-0.4215
10,Moderate,donald trump behavior as president and lasting damage to the office and our place in the world,0,0,0,2,0,0,0,0,0,-0.4939
10,Liberal,donald trump and his policies,0,0,,1,,0,1,0,1,0
10,Liberal,donald trump and the gop,0,0,,4,,0,0,0,0,0
10,Not sure,our current president racial divide how much poor people suffer,0,0,0,2,0,0,0,0,0,-0.765
10,Liberal,everything donald trump does,0,0,,2,,0,0,0,0,0
10,Very liberal,republican party democratic party the loud jack ass we have for a president and we live in an oligarchy,0,0,0,4,1,0,0,0,0,0.2263
10,Liberal,president donald trump,0,0,,2,,1,1,1,1,0
10,Liberal,donald trump and the inability of gop members of congress to stand up to him regarding ill thought out policies,0,0,0,1,0,0,0,0,0,-0.6705
10,Liberal,donald trump and the gop and the gops servility to donald trump and their refusal to hold him accountable,0,0,,1,,0,0,0,0,0
10,Moderate,donald trump supporters,0,0,1,2,1,0,0,0,0,0.4404
10,Moderate,presidents is hurting this country,0,0,0,3,0,0,0,0,0,-0.4019
10,Moderate,that we have a president who is a liar and a republican congress who lets him lie,0,0,0,4,0,0,0,0,0,-0.5106
10,Liberal,everything donald trump does,0,0,,3,,0,0,0,0,0
10,Moderate,the democrats not doing any thing that donald trump wants to do even when it would help america,0,1,1,1,1,0,0,1,1,0.4019
10,Very liberal,donald trump,0,0,,2,,0,0,0,0,0
10,Not sure,donald trump,0,0,,4,,0,0,0,0,0
